{
  "$schema": "https://agent-plugins.org/schemas/1.0.0/plugin.schema.json",
  "name": "morpheus-inference",
  "version": "0.1.0",
  "description": "Morpheus MoE via api.mor.org or private Uplink for Grok Bot.",
  "author": {
    "name": "NomadicRogue / ABSGrafx"
  },
  "repository": "https://github.com/absgrafx/morpheus-grok-mcp",
  "license": "MIT",
  "keywords": [
    "morpheus",
    "mcp",
    "openai-compatible",
    "moe",
    "uplink",
    "inference"
  ],
  "variables": {
    "type": "object",
    "properties": {
      "MORPHEUS_ENDPOINT_MODE": {
        "type": "string",
        "title": "Endpoint mode",
        "description": "public = https://api.mor.org/api/v1 ; custom = your Uplink https://<host>/v1",
        "enum": [
          "public",
          "custom"
        ],
        "default": "public"
      },
      "MORPHEUS_BASE_URL": {
        "type": "string",
        "title": "Custom Uplink base URL",
        "description": "Required when mode=custom. Auto-normalized to \u2026/v1 with warn if missing (no /chat/completions suffix). Never invent /api on Uplink."
      },
      "MORPHEUS_KEY_MODE": {
        "type": "string",
        "title": "Key mode",
        "description": "shared = one key; per_bot = discrete slot secrets or JSON map",
        "enum": [
          "shared",
          "per_bot"
        ],
        "default": "shared"
      },
      "MORPHEUS_API_KEY": {
        "type": "string",
        "title": "API key (shared)",
        "description": "Bearer sk-\u2026 from app.mor.org or Uplink Prompt/ephemeral. Never master. Secret \u2014 configure via Plugins \u2192 Configure / vault inject.",
        "secret": true
      },
      "MORPHEUS_API_KEY_COS": {
        "type": "string",
        "title": "API key slot: CoS",
        "description": "Per-bot discrete secret for role slot id `cos` when key mode is per_bot.",
        "secret": true
      },
      "MORPHEUS_API_KEY_CTO": {
        "type": "string",
        "title": "API key slot: CTO",
        "description": "Per-bot discrete secret for role slot id `cto` when key mode is per_bot.",
        "secret": true
      },
      "MORPHEUS_API_KEY_CISO": {
        "type": "string",
        "title": "API key slot: CISO",
        "description": "Per-bot discrete secret for role slot id `ciso` when key mode is per_bot.",
        "secret": true
      },
      "MORPHEUS_API_KEY_BUILDER": {
        "type": "string",
        "title": "API key slot: Builder",
        "description": "Per-bot discrete secret for role slot id `builder` when key mode is per_bot.",
        "secret": true
      },
      "MORPHEUS_API_KEY_OPERATIONS": {
        "type": "string",
        "title": "API key slot: Operations",
        "description": "Per-bot discrete secret for role slot id `operations` when key mode is per_bot.",
        "secret": true
      },
      "MORPHEUS_API_KEY_COMMS": {
        "type": "string",
        "title": "API key slot: Comms",
        "description": "Per-bot discrete secret for role slot id `comms` when key mode is per_bot.",
        "secret": true
      },
      "MORPHEUS_API_KEY_CFO": {
        "type": "string",
        "title": "API key slot: CFO",
        "description": "Per-bot discrete secret for role slot id `cfo` when key mode is per_bot.",
        "secret": true
      },
      "MORPHEUS_API_KEYS_JSON": {
        "type": "string",
        "title": "Per-bot key map (JSON escape hatch)",
        "description": "Optional JSON object mapping bot slot id \u2192 sk-\u2026 when key mode is per_bot. Prefer discrete slot vars; use map when host allows one install + map.",
        "secret": true
      },
      "MORPHEUS_AGENT_SLOT": {
        "type": "string",
        "title": "Agent slot id",
        "description": "Which per_bot slot to use (lowercase role key: cos,cto,ciso,builder,operations,comms,cfo). Also accepts MORPHEUS_AGENT."
      },
      "MORPHEUS_MODEL_DEFAULT": {
        "type": "string",
        "title": "Default model id",
        "description": "Exact catalog id from GET /models (not a display name)."
      },
      "MORPHEUS_POLICY_MOE_DEFAULT": {
        "type": "string",
        "title": "MoE default policy",
        "description": "true = prefer morpheus_chat for analysis",
        "enum": [
          "true",
          "false"
        ],
        "default": "true"
      },
      "MORPHEUS_POLICY_CURSOR_EXCEPTION": {
        "type": "string",
        "title": "Native/Cursor exception policy",
        "description": "true only when operator names a Cursor/native exception for the task",
        "enum": [
          "true",
          "false"
        ],
        "default": "false"
      },
      "MORPHEUS_POLICY_FALLBACK_ON_DOWN": {
        "type": "string",
        "title": "Fallback when Morpheus down",
        "description": "true = allow native fallback on 404/502/auth/empty and must surface: Morpheus didn\u2019t work: <reason>",
        "enum": [
          "true",
          "false"
        ],
        "default": "true"
      }
    },
    "required": [
      "MORPHEUS_ENDPOINT_MODE"
    ]
  }
}
